{
  "$schema": "ldc/behaviors/v1",
  "id": "graybox-swift",

  "stateWeights": {
    "Idle": 22,
    "Walk": 26,
    "Sit": 30,
    "Sleep": 22
  },

  "personalityBias": {
    "Walk": { "energy": { "sensitivity": 0.9 } },
    "Sit": { "energy": { "sensitivity": -0.3 } },
    "Sleep": { "energy": { "sensitivity": -0.4 } },
    "Idle": { "curiosity": { "sensitivity": 0.3 } }
  },

  "interactionResponse": {},

  "microBehaviors": [
    { "id": "earTwitch", "chancePerMin": 12 },
    { "id": "headTilt", "chancePerMin": 5 }
  ],

  "extraRandomness": 0.15
}
